<?xml version='1.0' encoding='UTF-8'?>
<!DOCTYPE dataset SYSTEM "src/test/resources/dbunit/test.dtd">
<dataset>
    <role id="-3" name="subscriber"/>
    <role id="-2" name="admin"/>
    <role id="-1" name="guest"/>
    <user_profile id="-4" login="vlasov@email.com" password="alex" role_id="-3" subscribed="true"/>
    <user_profile id="-3" login="kuchin@email.com" password="viktor" role_id="-2"/>
    <user_profile id="-2" login="anakin@email.com" password="alex" role_id="-2"/>
    <user_profile id="-1" login="guest" password="guest" role_id="-1"/>
</dataset>
