<?xml version='1.0' encoding='UTF-8'?>
<!DOCTYPE dataset SYSTEM "src/test/resources/dbunit/test.dtd">
<dataset>
    <city id="-4" name="Odessa" details="Odessa, Florida, USA" point="POINT(-82.568333 28.183333)"/>
    <city id="-3" name="Boyarka" point="POINT(30.28861 50.32917)"/>
    <city id="-2" name="Odessa" point="POINT(30.73333 46.46667)"/>
    <city id="-1" name="Kyiv" point="POINT(30.523 50.4505)"/>
    <currency id="-3" name="Euro"/>
    <currency id="-2" name="&#1043;&#1088;&#1080;&#1074;&#1085;&#1072;"/>
    <currency id="-1" name="USD"/>
    <event id="-7" title="Delphi" event_date="2115-07-05 00:00:00.0" reg_link="http://www.delphi.com.ua"
           address="Arsenalna" point="POINT(30.547603 50.442843)" contact="delphi@gmail.com" price="30" currency_id="-1"
           city_id="-1"/>
    <event id="-6" title="CSharp" event_date="2115-07-09 00:00:00.0" reg_link="http://www.c#.com.ua"
           address="Khreschatyk" point="POINT(30.52239 50.447694)" contact="csharp@gmail.com" price="20"
           currency_id="-3" city_id="-3"/>
    <event id="-5" title="ObjectiveC" event_date="2115-07-05 00:00:00.0" reg_link="http://www.objective-c.com.ua"
           address="Provectus" point="POINT(30.758417 46.472508)" contact="objectivec@gmail.com" price="20"
           currency_id="-3" city_id="-2"/>
    <event id="-4" title="CPlusPlus" event_date="2115-07-15 00:00:00.0" reg_link="http://www.cplusplus.com.ua"
           address="Impact Hub" point="POINT(30.747175 46.481782)" contact="cplusplus@gmail.com" price="20"
           currency_id="-3" city_id="-2"/>
    <event id="-3" title="JS" event_date="2115-07-30 00:00:00.0" reg_link="http://www.js.com.ua" address="Nyvky"
           point="POINT(30.403965 50.458651)" contact="js@gmail.com" price="20" currency_id="-3" city_id="-1"/>
    <event id="-2" title="PHP" event_date="2115-07-20 00:00:00.0" reg_link="http://www.php.com.ua" address="Shulyavska"
           point="POINT(30.445495 50.454605)" contact="php@gmail.com" city_id="-3"/>
    <event id="-1" title="Java" event_date="2115-07-10 00:00:00.0" reg_link="http://www.java.com.ua"
           address="Beresteyska" point="POINT(30.742017 50.458585)" contact="java@gmail.com" city_id="-1"/>
    <technology id="-10" name="SQL"/>
    <technology id="-9" name="MyBatis"/>
    <technology id="-8" name="Spring"/>
    <technology id="-7" name="Ant"/>
    <technology id="-6" name="Maven"/>
    <technology id="-5" name="Gradle"/>
    <technology id="-4" name="Liquibase"/>
    <technology id="-3" name="PHP"/>
    <technology id="-2" name="JavaScript"/>
    <technology id="-1" name="Java"/>
    <event_technology event_id="-7" technology_id="-7"/>
    <event_technology event_id="-6" technology_id="-6"/>
    <event_technology event_id="-5" technology_id="-5"/>
    <event_technology event_id="-4" technology_id="-3"/>
    <event_technology event_id="-4" technology_id="-1"/>
    <event_technology event_id="-3" technology_id="-3"/>
    <event_technology event_id="-2" technology_id="-2"/>
    <event_technology event_id="-1" technology_id="-9"/>
    <event_technology event_id="-1" technology_id="-8"/>
    <event_technology event_id="-1" technology_id="-4"/>
    <event_technology event_id="-1" technology_id="-1"/>
</dataset>
